{
  "iso2": "CN",
  "iso3": "CHN",
  "name": {
    "nl": "China",
    "en": "China"
  },
  "region": "Asia",
  "passportIndex": {
    "score": 82,
    "maxDestinations": 227,
    "note": "A modest score, but currently the most influential visa diplomat: China itself grants visa-free entry to dozens of countries and is reaping the reciprocity."
  },
  "flags": {
    "euMember": false,
    "schengenMember": false,
    "usVisaWaiver": false,
    "citizenshipByInvestment": false
  },
  "dualNationality": {
    "status": "not_allowed",
    "note": "China does not recognize dual nationality; naturalizing elsewhere formally means losing Chinese citizenship."
  },
  "sources": [
    {
      "label": "Henley Passport Index 2026",
      "url": "https://www.henleyglobal.com/passport-index",
      "accessedDate": "2026-07-13",
      "fields": [
        "passportIndex.score",
        "flags"
      ]
    }
  ],
  "lastUpdated": "2026-07-13"
}
