{
  "iso2": "UA",
  "iso3": "UKR",
  "name": {
    "nl": "Oekraïne",
    "en": "Ukraine"
  },
  "region": "Europe",
  "passportIndex": {
    "score": 143,
    "maxDestinations": 227,
    "note": "Visa-free in Schengen since 2017; the score has remained remarkably stable despite the war."
  },
  "flags": {
    "euMember": false,
    "schengenMember": false,
    "usVisaWaiver": false,
    "citizenshipByInvestment": false
  },
  "dualNationality": {
    "status": "restricted",
    "note": "Historically not recognized, but recently eased by legislation toward multiple citizenship."
  },
  "sources": [
    {
      "label": "Henley Passport Index 2026",
      "url": "https://www.henleyglobal.com/passport-index",
      "accessedDate": "2026-07-13",
      "fields": [
        "passportIndex.score",
        "flags"
      ]
    }
  ],
  "lastUpdated": "2026-07-13"
}
