{
  "iso2": "NR",
  "iso3": "NRU",
  "name": {
    "nl": "Nauru",
    "en": "Nauru"
  },
  "region": "Oceania",
  "passportIndex": {
    "score": 87,
    "maxDestinations": 227,
    "note": null
  },
  "flags": {
    "euMember": false,
    "schengenMember": false,
    "usVisaWaiver": false,
    "citizenshipByInvestment": true
  },
  "dualNationality": {
    "status": "restricted",
    "note": null
  },
  "sources": [
    {
      "label": "Henley Passport Index 2026",
      "url": "https://www.henleyglobal.com/passport-index",
      "accessedDate": "2026-07-13",
      "fields": [
        "passportIndex.score",
        "flags"
      ]
    }
  ],
  "lastUpdated": "2026-07-13"
}
