{
  "iso2": "AU",
  "iso3": "AUS",
  "name": {
    "nl": "Australië",
    "en": "Australia"
  },
  "region": "Oceania",
  "passportIndex": {
    "score": 182,
    "maxDestinations": 227,
    "note": "Reciprocal residency rights with New Zealand; e-visa arrangements with China are loosening quickly."
  },
  "flags": {
    "euMember": false,
    "schengenMember": false,
    "usVisaWaiver": true,
    "citizenshipByInvestment": false
  },
  "dualNationality": {
    "status": "allowed",
    "note": null
  },
  "sources": [
    {
      "label": "Henley Passport Index 2026",
      "url": "https://www.henleyglobal.com/passport-index",
      "accessedDate": "2026-07-13",
      "fields": [
        "passportIndex.score",
        "flags"
      ]
    }
  ],
  "lastUpdated": "2026-07-13"
}
