{
  "iso2": "FR",
  "iso3": "FRA",
  "name": {
    "nl": "Frankrijk",
    "en": "France"
  },
  "region": "Europe",
  "passportIndex": {
    "score": 185,
    "maxDestinations": 227,
    "note": "Beyond travel freedom: access to French overseas territories on five continents."
  },
  "flags": {
    "euMember": true,
    "schengenMember": true,
    "usVisaWaiver": true,
    "citizenshipByInvestment": false
  },
  "dualNationality": {
    "status": "allowed",
    "note": null
  },
  "sources": [
    {
      "label": "Henley Passport Index 2026",
      "url": "https://www.henleyglobal.com/passport-index",
      "accessedDate": "2026-07-13",
      "fields": [
        "passportIndex.score",
        "flags"
      ]
    }
  ],
  "lastUpdated": "2026-07-13"
}
