{
  "iso2": "TR",
  "iso3": "TUR",
  "name": {
    "nl": "Turkije",
    "en": "Turkey"
  },
  "region": "Europe",
  "passportIndex": {
    "score": 113,
    "maxDestinations": 227,
    "note": "CBI via real estate from $400,000 — the world's best-selling investment passport. Schengen, however, still requires a visa."
  },
  "flags": {
    "euMember": false,
    "schengenMember": false,
    "usVisaWaiver": false,
    "citizenshipByInvestment": true
  },
  "dualNationality": {
    "status": "allowed",
    "note": "Fully allowed — one reason it's the world's most popular CBI country."
  },
  "sources": [
    {
      "label": "Henley Passport Index 2026",
      "url": "https://www.henleyglobal.com/passport-index",
      "accessedDate": "2026-07-13",
      "fields": [
        "passportIndex.score",
        "flags"
      ]
    }
  ],
  "lastUpdated": "2026-07-13"
}
