{
  "iso2": "VU",
  "iso3": "VUT",
  "name": {
    "nl": "Vanuatu",
    "en": "Vanuatu"
  },
  "region": "Oceania",
  "passportIndex": {
    "score": 89,
    "maxDestinations": 227,
    "note": "The world's fastest CBI (around 2 months), but lost visa-free Schengen access — a lesson in program risk."
  },
  "flags": {
    "euMember": false,
    "schengenMember": false,
    "usVisaWaiver": false,
    "citizenshipByInvestment": true
  },
  "dualNationality": {
    "status": "allowed",
    "note": null
  },
  "sources": [
    {
      "label": "Henley Passport Index 2026",
      "url": "https://www.henleyglobal.com/passport-index",
      "accessedDate": "2026-07-13",
      "fields": [
        "passportIndex.score",
        "flags"
      ]
    }
  ],
  "lastUpdated": "2026-07-13"
}
