{
  "iso2": "VC",
  "iso3": "VCT",
  "name": {
    "nl": "Saint Vincent en de Grenadines",
    "en": "Saint Vincent and the Grenadines"
  },
  "region": "Caribbean",
  "passportIndex": {
    "score": 158,
    "maxDestinations": 227,
    "note": null
  },
  "flags": {
    "euMember": false,
    "schengenMember": false,
    "usVisaWaiver": false,
    "citizenshipByInvestment": false
  },
  "dualNationality": {
    "status": "allowed",
    "note": null
  },
  "sources": [
    {
      "label": "Henley Passport Index 2026",
      "url": "https://www.henleyglobal.com/passport-index",
      "accessedDate": "2026-07-13",
      "fields": [
        "passportIndex.score",
        "flags"
      ]
    }
  ],
  "lastUpdated": "2026-07-13"
}
