{
  "iso2": "GB",
  "iso3": "GBR",
  "name": {
    "nl": "Verenigd Koninkrijk",
    "en": "United Kingdom"
  },
  "region": "Europe",
  "passportIndex": {
    "score": 182,
    "maxDestinations": 227,
    "note": "Ranked number 1 in 2015; has steadily declined since Brexit but still sits in the top 10."
  },
  "flags": {
    "euMember": false,
    "schengenMember": false,
    "usVisaWaiver": true,
    "citizenshipByInvestment": false
  },
  "dualNationality": {
    "status": "allowed",
    "note": null
  },
  "sources": [
    {
      "label": "Henley Passport Index 2026",
      "url": "https://www.henleyglobal.com/passport-index",
      "accessedDate": "2026-07-13",
      "fields": [
        "passportIndex.score",
        "flags"
      ]
    }
  ],
  "lastUpdated": "2026-07-13"
}
