{
  "iso2": "ZA",
  "iso3": "ZAF",
  "name": {
    "nl": "Zuid-Afrika",
    "en": "South Africa"
  },
  "region": "Africa",
  "passportIndex": {
    "score": 100,
    "maxDestinations": 227,
    "note": "Back in the top 50 after a decade; the strongest passport in continental Sub-Saharan Africa."
  },
  "flags": {
    "euMember": false,
    "schengenMember": false,
    "usVisaWaiver": false,
    "citizenshipByInvestment": false
  },
  "dualNationality": {
    "status": "restricted",
    "note": "Allowed provided prior permission (retention) is applied for — forgetting to do so costs you your South African passport."
  },
  "sources": [
    {
      "label": "Henley Passport Index 2026",
      "url": "https://www.henleyglobal.com/passport-index",
      "accessedDate": "2026-07-13",
      "fields": [
        "passportIndex.score",
        "flags"
      ]
    }
  ],
  "lastUpdated": "2026-07-13"
}
