{
  "iso2": "QA",
  "iso3": "QAT",
  "name": {
    "nl": "Qatar",
    "en": "Qatar"
  },
  "region": "Middle East",
  "passportIndex": {
    "score": 112,
    "maxDestinations": 227,
    "note": "Unique: the only Gulf passport in the US Visa Waiver Program (since 2024)."
  },
  "flags": {
    "euMember": false,
    "schengenMember": false,
    "usVisaWaiver": true,
    "citizenshipByInvestment": false
  },
  "dualNationality": {
    "status": "not_allowed",
    "note": null
  },
  "sources": [
    {
      "label": "Henley Passport Index 2026",
      "url": "https://www.henleyglobal.com/passport-index",
      "accessedDate": "2026-07-13",
      "fields": [
        "passportIndex.score",
        "flags"
      ]
    }
  ],
  "lastUpdated": "2026-07-13"
}
